,tweet_source,tweet_text,tweet_date,tweet_vader_score,tweet_pos_score,tweet_neu_score,tweet_neg_score
0,Fox News,BREAKING: Federal appeals court rules against Trump administration on DACA https://t.co/KHnrNvEKAM,Thu Nov 08 19:18:44 +0000 2018,0.0,0.0,1.0,0.0
1,Fox News,"Breaking News: Grand jury indicts captain of Missouri duck boat that sank in severe weather, killing 17 people https://t.co/ffOOgzRwdo",Thu Nov 08 17:02:25 +0000 2018,-0.6124,0.115,0.615,0.269
2,Fox News,"JUST IN: Police identify gunman who opened fire inside California bar, killing 12 https://t.co/PvITYr54AX",Thu Nov 08 15:14:45 +0000 2018,-0.7783,0.0,0.638,0.362
3,Fox News,JUST IN: Supreme Court Justice Ruth Bader Ginsburg fractures 3 ribs in fall https://t.co/9UM9hKTz4m,Thu Nov 08 14:22:51 +0000 2018,0.7906,0.389,0.611,0.0
4,Fox News,"Sgt. Ron Helus was fatally shot when he responded to the mass shooting on Nov. 7 at a bar in Thousand Oaks, Califor… https://t.co/vOH3OWPN5S",Thu Nov 08 13:43:25 +0000 2018,-0.6369,0.0,0.833,0.167
5,Fox News,Tom Homan: “It’s a tragedy each and every time.” https://t.co/dMV68Hfdz0 https://t.co/hrq51VJg7x,Thu Nov 08 13:35:03 +0000 2018,-0.6597,0.0,0.672,0.328
6,Fox News,"People walk away from the scene in Thousand Oaks, Calif. where a gunman opened fire Wednesday.… https://t.co/O3Oo2iLL8O",Thu Nov 08 13:22:27 +0000 2018,-0.34,0.0,0.862,0.138
7,Fox News,Teylor Whittler describes what she witnessed at California bar shooting https://t.co/dMV68Hfdz0 https://t.co/YznTZgQoYY,Thu Nov 08 12:56:20 +0000 2018,0.0,0.0,1.0,0.0
8,Fox News,"An FBI agent talks to a potential witness as they stand near the scene in Thousand Oaks, Calif. where a gunman open… https://t.co/7QOmXNTYM0",Thu Nov 08 12:37:05 +0000 2018,0.0,0.0,1.0,0.0
9,Fox News,Ventura County Fire Department Captain Stan Ziegler: “Hundreds of first responders responded initially to the scene… https://t.co/o4gArhmy4e,Thu Nov 08 12:25:14 +0000 2018,-0.34,0.0,0.87,0.13
10,Fox News,"People comfort each other as they stand near the scene in Thousand Oaks, Calif. where a gunman opened fire during a… https://t.co/wPI4XSpirC",Thu Nov 08 12:06:14 +0000 2018,0.0258,0.105,0.795,0.1
11,Fox News,"California bar shooting leaves 12 dead, including sheriff's sergeant, police say https://t.co/dMV68Hfdz0 https://t.co/WvjarPpwPV",Thu Nov 08 11:54:22 +0000 2018,-0.6486,0.0,0.736,0.264
12,Fox News,"California bar shooting leaves 12 dead, including sheriff's sergeant, police say https://t.co/GqI77wMuYZ",Thu Nov 08 11:38:17 +0000 2018,-0.6486,0.0,0.719,0.281
13,Fox News,"Sheriff's deputies speak to potential witnesses as they stand near the scene in Thousand Oaks, Calif., where a gunm… https://t.co/jPE8k9oQHr",Thu Nov 08 11:32:26 +0000 2018,0.0,0.0,1.0,0.0
14,Fox News,13 dead in country music bar including gunman https://t.co/PvITYr54AX https://t.co/UURBIatqte,Thu Nov 08 11:26:46 +0000 2018,-0.6486,0.0,0.677,0.323
15,Fox News,"12 dead in shooting at Thousand Oaks nightclub, police say https://t.co/PvITYr54AX https://t.co/o8Nf8WuJcZ",Thu Nov 08 11:18:08 +0000 2018,-0.6486,0.0,0.719,0.281
16,Fox News,"Breaking News: At least 12 dead in shooting at Thousand Oaks nightclub, police say https://t.co/u6sVxdzHq5",Thu Nov 08 11:13:32 +0000 2018,-0.6486,0.0,0.765,0.235
17,Fox News,.@CarleyShimkus is live with the ‘Fox News Update’ on Facebook Watch: https://t.co/hNrB8xzepH https://t.co/cQ9uxkjUIK,Thu Nov 08 11:12:14 +0000 2018,0.0,0.0,1.0,0.0
18,Fox News,"Authorities deliver an update on the shooting in Thousand Oaks, California. (Courtesy: KABC) https://t.co/BtGxxIfNx5",Thu Nov 08 10:53:33 +0000 2018,0.0,0.0,1.0,0.0
19,Fox News,Pastor Dimas Salaberrios on California shooting: “My immediate thoughts go out to the families. Because what’s happ… https://t.co/iowf5VOL2l,Thu Nov 08 10:36:12 +0000 2018,0.0,0.0,1.0,0.0
20,CNN,"China has completed its first public test of a Mars lander, keeping the country on track for an unmanned exploratio… https://t.co/dQUNt5VmwE",Sat Nov 16 09:16:04 +0000 2019,0.0,0.0,1.0,0.0
21,CNN,A child prodigy from Belgium is on course to gain a bachelor's degree at the tender age of nine. He plans to embark… https://t.co/wTSpw6Gwaq,Sat Nov 16 09:01:04 +0000 2019,0.5267,0.139,0.861,0.0
22,CNN,"Here's what it's like to fly on the world's longest passenger flight, from London to Sydney in 19 hours and 19 minu… https://t.co/hwZzMDqS7o",Sat Nov 16 08:46:08 +0000 2019,0.3612,0.102,0.898,0.0
23,CNN,"Meet the gaming world's first transgender hero. ""Tell Me Why"" by Xbox Game Studios is the first video game by a maj… https://t.co/uRUipI2wD1",Sat Nov 16 08:31:03 +0000 2019,0.5574,0.146,0.854,0.0
24,CNN,"You can get paid $1,000 to binge watch 24 Hallmark Christmas movies in 12 days https://t.co/RloLTfelx3 https://t.co/469SbctMKo",Sat Nov 16 08:16:05 +0000 2019,0.0,0.0,1.0,0.0
25,CNN,Pope Francis said some of the things he's heard targeting Jews and the LGBTQ community remind him of the days of Ad… https://t.co/3bV1mIRFyJ,Sat Nov 16 08:01:07 +0000 2019,0.0,0.0,1.0,0.0
26,CNN,This is the world's largest Starbucks https://t.co/fZqY1X8b4H https://t.co/GPCLleq8qY,Sat Nov 16 07:46:06 +0000 2019,0.0,0.0,1.0,0.0
27,CNN,"Whether or not you can read and write could be a factor in your ability to stave off dementia as you grow older, ac… https://t.co/t4vCRv4udb",Sat Nov 16 07:39:09 +0000 2019,0.3182,0.091,0.909,0.0
28,CNN,"Meet Narwhal, a 10-week-old rescue puppy with a special tail on his forehead that has catapulted him to internet fa… https://t.co/MzaZ3UDDnI",Sat Nov 16 07:31:05 +0000 2019,0.7184,0.261,0.739,0.0
29,CNN,"Gunfire broke out at a high school football game in New Jersey on Friday night, sending terrified fans diving under… https://t.co/Xs4UbOzz2T",Sat Nov 16 07:21:25 +0000 2019,-0.7579,0.052,0.677,0.271
30,CNN,"Automotive company VinFast's first electric scooter, Klara, could create an environmentally friendly option for Han… https://t.co/SRey4VGuwq",Sat Nov 16 07:16:09 +0000 2019,0.6486,0.275,0.725,0.0
31,CNN,"Kateryna Handziuk, who died in 2018 following an acid attack, was brought up today because on April 25 — when Marie… https://t.co/puZ0fct3fE",Sat Nov 16 07:01:04 +0000 2019,-0.7717,0.0,0.739,0.261
32,CNN,An astonishing week closes with a wild new window into President Trump's style | Analysis by CNN's @zbyronwolf… https://t.co/GnFOg32XBh,Sat Nov 16 06:46:07 +0000 2019,0.0,0.0,1.0,0.0
33,CNN,"A blazing meteor lit up the night sky this week in St. Louis, Missouri, and was caught on video by excited resident… https://t.co/QexYZkGFr7",Sat Nov 16 06:31:09 +0000 2019,0.34,0.103,0.897,0.0
34,CNN,"What is, ""We ❤️ you Alex!""

""Jeopardy!"" host Alex Trebek choked up after a contestant used his Final Jeopardy answe… https://t.co/yLE5KhMOMO",Sat Nov 16 06:16:08 +0000 2019,-0.7772,0.0,0.737,0.263
35,CNN,"Nike's new shoe was not created for athletes such as basketball players or tennis players, but for a different crow… https://t.co/CVEvtWJndJ",Sat Nov 16 06:01:02 +0000 2019,-0.0951,0.0,0.933,0.067
36,CNN,More than 13% of Americans — about 34 million people — say a friend or family member recently passed away in the la… https://t.co/iQYFCEHJ2y,Sat Nov 16 05:51:06 +0000 2019,0.4939,0.138,0.862,0.0
37,CNN,"Veneto regional council, which is located on Venice's Grand Canal, was flooded for the first time in its history on… https://t.co/Px3nOdkttA",Sat Nov 16 05:42:29 +0000 2019,0.4588,0.13,0.87,0.0
38,CNN,Sully the service dog wagged into stardom when a picture of him next to former President George H.W. Bush's casket… https://t.co/ndU371nwLY,Sat Nov 16 05:31:03 +0000 2019,0.0,0.0,1.0,0.0
39,CNN,"Exclusive: After private White House meeting, Giuliani associate Lev Parnas said he was on a 'secret mission' for T… https://t.co/BxMSZRtEDA",Sat Nov 16 05:16:04 +0000 2019,0.128,0.077,0.923,0.0
40,BBC News (World),Climate change: Irish Youth Assembly demands action https://t.co/bH1qUt6vSF,Sat Nov 16 08:00:30 +0000 2019,0.0,0.0,1.0,0.0
41,BBC News (World),Impeachment inquiry: Trump 'asked for probe in Ukraine with envoy' https://t.co/bwfxkx4msh,Sat Nov 16 05:48:38 +0000 2019,0.0,0.0,1.0,0.0
42,BBC News (World),Sri Lanka votes for president in shadow of Easter Sunday attack https://t.co/PYBaT7d9We,Sat Nov 16 01:35:56 +0000 2019,-0.4767,0.0,0.78,0.22
43,BBC News (World),In pictures: Havana celebrates 500 years of foundation https://t.co/iKH4TGwDkm,Sat Nov 16 01:29:08 +0000 2019,0.5719,0.316,0.684,0.0
44,BBC News (World),Rodney Reed: Texas court halts execution in high-profile case https://t.co/r1Ee7neyUV,Sat Nov 16 01:03:34 +0000 2019,0.0,0.0,1.0,0.0
45,BBC News (World),Gilets Jaunes: Anger of yellow vests still grips France a year on https://t.co/Bm4n1ypp19,Sat Nov 16 00:17:59 +0000 2019,-0.5719,0.0,0.748,0.252
46,BBC News (World),Velvet Revolution: Prague's ghosts of communism https://t.co/4TXIRm3evX,Sat Nov 16 00:13:25 +0000 2019,0.0,0.0,1.0,0.0
47,BBC News (World),Israel-Gaza: Israel vows to investigate civilian death claims https://t.co/0FxNA1hahz,Fri Nov 15 23:34:15 +0000 2019,-0.5994,0.0,0.672,0.328
48,BBC News (World),Bolivia crisis: Former President Evo Morales dismisses charges threat https://t.co/pP9ykVsEIN,Fri Nov 15 23:11:53 +0000 2019,-0.8625,0.0,0.422,0.578
49,BBC News (World),Iraq protests: Top Shia cleric gives support to protests https://t.co/oD8bZ0nYa5,Fri Nov 15 22:58:13 +0000 2019,0.1779,0.315,0.42,0.266
50,BBC News (World),Inventor of the famed 'Sourtoe Cocktail' has died https://t.co/4u4y2REJlV,Fri Nov 15 22:53:03 +0000 2019,-0.5574,0.0,0.69,0.31
51,BBC News (World),"RT @BBCNewsnight: ""I have no recollection of ever meeting this lady.""

The Duke of York has spoken for the first time about his links to Je…",Fri Nov 15 22:02:36 +0000 2019,-0.296,0.0,0.919,0.081
52,BBC News (World),"RT @BBCNewsnight: ""It was not something that was becoming of a member of the Royal family... I let the side down.""

Prince Andrew speaks ex…",Fri Nov 15 22:02:32 +0000 2019,0.0,0.0,1.0,0.0
53,BBC News (World),"RT @BBCBreaking: Prince Andrew tells BBC he ""let the side down"" by staying at home of convicted US sex offender Jeffrey Epstein https://t.c…",Fri Nov 15 22:01:38 +0000 2019,-0.3612,0.0,0.898,0.102
54,BBC News (World),How Irish hurling came to the US https://t.co/jftjn2A1LQ,Fri Nov 15 21:17:36 +0000 2019,0.0,0.0,1.0,0.0
55,BBC News (World),'One in a million' three antler deer spotted in US https://t.co/c0w639VcBP,Fri Nov 15 20:45:51 +0000 2019,0.0,0.0,1.0,0.0
56,BBC News (World),"RT @awzurcher: Today's public impeachment hearing almost over. The committee members now will head to a closed-door meeting, where they wil…",Fri Nov 15 20:28:46 +0000 2019,0.0,0.0,1.0,0.0
57,BBC News (World),How a Trump tweet shook impeachment hearing https://t.co/WhcfvrS2dq,Fri Nov 15 20:20:24 +0000 2019,-0.1027,0.0,0.811,0.189
58,BBC News (World),@rituprasad92 @LauraTrevelyan @csbuckler Republicans now get their turn to question former Ukraine ambassador Marie… https://t.co/ZgtKBCVDPY,Fri Nov 15 17:33:47 +0000 2019,0.0,0.0,1.0,0.0
59,BBC News (World),"RT @BBCBreaking: Roger Stone, former adviser to President Donald Trump, convicted on charges stemming from Russia inquiry https://t.co/h55R…",Fri Nov 15 16:57:42 +0000 2019,-0.2732,0.0,0.89,0.11
60,CBS News,"A juvenile and an adult male are ""seriously injured"" after being shot at a high school football game in New Jersey… https://t.co/q6bcHzsE8i",Sat Nov 16 04:02:41 +0000 2019,-0.5267,0.0,0.804,0.196
61,CBS News,"This holiday season, shoppers can keep the change and donate to the Salvation Army with Google Pay and Apple Pay… https://t.co/RHsVYHpsGo",Sat Nov 16 03:39:31 +0000 2019,0.3182,0.117,0.823,0.061
62,CBS News,"Elite Marine unit practices day and night to ensure fellow Marines get the ""flawless"" funeral procession they deser… https://t.co/iu0nty4VyG",Sat Nov 16 03:19:37 +0000 2019,0.0258,0.118,0.769,0.113
63,CBS News,"Trump's former campaign adviser, Roger Stone, has been found guilty of lying to Congress, witness tampering and obs… https://t.co/VXTTY4hAHG",Sat Nov 16 02:59:32 +0000 2019,-0.7351,0.0,0.733,0.267
64,CBS News,Boeing and SpaceX face major technical challenges that threaten to delay initial flights of U.S. commercial astrona… https://t.co/cdKjsbDmyq,Sat Nov 16 02:39:39 +0000 2019,-0.5574,0.061,0.708,0.231
65,CBS News,"While farmers anxiously await a formal trade deal, makers of farming equipment are trimming their workforces amid s… https://t.co/dFvGdfhGCk",Sat Nov 16 02:19:44 +0000 2019,-0.128,0.073,0.829,0.098
66,CBS News,Cleveland Brown star Myles Garrett has been suspended indefinitely by the NFL for ripping off Pittsburgh Steelers q… https://t.co/lNb7Yuq3nO,Sat Nov 16 01:59:52 +0000 2019,-0.4767,0.0,0.853,0.147
67,CBS News,"After Thursday's school shooting in Santa Clarita, California, Washington faces renewed questions about national pr… https://t.co/DHAbkoT9Sn",Sat Nov 16 01:39:41 +0000 2019,0.0,0.0,1.0,0.0
68,CBS News,"Nancy Pelosi says  President Trump's ongoing attacks on witnesses in the impeachment probe are ""very significant""… https://t.co/5254OVdItd",Sat Nov 16 01:19:52 +0000 2019,-0.4404,0.0,0.847,0.153
69,CBS News,BREAKING: The shooter who killed two classmates at Saugus High School in California on Thursday has died from his i… https://t.co/1fqXJFcuE8,Sat Nov 16 01:02:57 +0000 2019,-0.8442,0.0,0.701,0.299
70,CBS News,8 striking moments in the 2nd day of public impeachment hearings https://t.co/ccvtjQCQor https://t.co/DcdTivh2yU,Sat Nov 16 00:39:33 +0000 2019,0.0,0.0,1.0,0.0
71,CBS News,Black borrowers are twice as likely to default on their student loans than white borrowers https://t.co/uA8IENHEw1 https://t.co/nN8Pfzv50j,Sat Nov 16 00:19:32 +0000 2019,0.0,0.0,1.0,0.0
72,CBS News,"RT @CBSEveningNews: PROFILES IN SERVICE: Few Marines are tougher, and none  stronger, than the elite unit that shoulders the burden of Amer…",Sat Nov 16 00:06:39 +0000 2019,-0.5242,0.066,0.737,0.197
73,CBS News,"RT @CBSEveningNews: In an exclusive @BBCNewsnight interview, Britain's Prince Andrew denies accusations of having underage sex with one of…",Sat Nov 16 00:06:36 +0000 2019,-0.5574,0.066,0.708,0.226
74,CBS News,"RT @CBSEveningNews: Roger Stone, a longtime ally of Pres. Trump, was found guilty on 7 charges Friday; prosecutors said Stone lied to prote…",Sat Nov 16 00:06:31 +0000 2019,-0.7579,0.0,0.706,0.294
75,CBS News,"RT @CBSEveningNews: NEW: @margbrennan: ""Why do you think [Pres. Trump] was tweeting about [Marie Yovanovitch]?""
@SpeakerPelosi: ""He made a…",Sat Nov 16 00:06:29 +0000 2019,0.0,0.0,1.0,0.0
76,CBS News,"RT @CBSEveningNews: NEW: Source tells @margbrennan that David Holmes' testimony presents not only new problems for @POTUS, but for Amb. Gor…",Sat Nov 16 00:06:27 +0000 2019,0.1603,0.075,0.925,0.0
77,CBS News,RT @CBSEveningNews: MORE: Pres. Trump later dismissed Democrats’ accusations of witness tampering after tweeting during former Amb. Marie Y…,Sat Nov 16 00:06:25 +0000 2019,-0.3182,0.0,0.887,0.113
78,CBS News,"RT @CBSEveningNews: Marie Yovanovitch, a 33-year veteran of foreign service, testified she was the victim of a “smear campaign” waged by “f…",Sat Nov 16 00:06:22 +0000 2019,-0.2732,0.0,0.9,0.1
79,CBS News,"""This is not a time to undercut our diplomats.""

Marie Yovanovitch, the former U.S. ambassador to Ukraine, testifie… https://t.co/NqCMrM5blz",Sat Nov 16 00:00:42 +0000 2019,0.0,0.0,1.0,0.0
80,The New York Times,Astronomers believe that a supermassive black hole in the middle of the Milky Way has thrown a star out of the cent… https://t.co/EWz06egDQl,Sat Nov 16 09:00:54 +0000 2019,0.0,0.0,1.0,0.0
81,The New York Times,"RT @AKurmanaev: Evo’s fall has opened up Bolivia’s old ethnic wounds, which both extremes are now exploiting in their struggle for power. O…",Sat Nov 16 08:30:09 +0000 2019,-0.6369,0.0,0.802,0.198
82,The New York Times,"RT @nytimesworld: A new book explains why there's an entire subculture of Bollywood fans in Peru, all indigenous Peruvians who don’t speak…",Sat Nov 16 08:00:12 +0000 2019,0.0,0.0,1.0,0.0
83,The New York Times,"RT @NYTSports: “As soon as you put the jersey on, nothing underneath it matters,” said Alexander LeFebvre, 25, the goalie for Team Trans. “…",Sat Nov 16 07:30:10 +0000 2019,0.0,0.0,1.0,0.0
84,The New York Times,China’s internet is flowering. And one of its anchors: WeChat. “To spend any amount of time in China today is to un… https://t.co/KeuWkd2W52,Sat Nov 16 07:00:06 +0000 2019,0.0,0.0,1.0,0.0
85,The New York Times,RT @eringriffith: I’ve wanted to write about ⁦@DipseaStories⁩ ever since I first heard of it. Here’s what it’s like to run an erotic podcas…,Sat Nov 16 06:30:07 +0000 2019,0.3612,0.102,0.898,0.0
86,The New York Times,"2 algal species share important genes with all modern land plants, a new analysis finds https://t.co/t3jfX3BjGc",Sat Nov 16 06:00:09 +0000 2019,0.4588,0.25,0.75,0.0
87,The New York Times,The Supreme Court agreed to decide whether Google should have to pay Oracle billions of dollars in a long-running c… https://t.co/sGqutnKy1b,Sat Nov 16 05:40:06 +0000 2019,0.6486,0.237,0.705,0.058
88,The New York Times,"RT @gettinviggy: In a rare public moment of contrition for a member of Britain’s royal family, Prince Andrew said this week that it was wro…",Sat Nov 16 05:20:02 +0000 2019,0.0,0.0,1.0,0.0
89,The New York Times,Keith Haring's 85-foot mural — painted up the stairs of a youth center and brought down decades later — has sold to… https://t.co/L1GkIgVQdv,Sat Nov 16 05:10:04 +0000 2019,0.0,0.0,1.0,0.0
90,The New York Times,"RT @nytimesarts: James Holzhauer beat Emma Boettcher to come out on top in their rematch on the ""Jeopardy!"" stage. https://t.co/8d0mvebxLN",Sat Nov 16 04:50:01 +0000 2019,0.2714,0.099,0.901,0.0
91,The New York Times,A grizzly’s body can slow down for months without damage. Researchers wonder if the ability can be harnessed to aid… https://t.co/vTjjnXycKQ,Sat Nov 16 04:40:05 +0000 2019,0.6031,0.215,0.785,0.0
92,The New York Times,"RT @nytpolitics: Conservative Republicans tend to be more passionate about immigration issues, but Democratic organizers see an opportunity…",Sat Nov 16 04:20:04 +0000 2019,0.3284,0.121,0.879,0.0
93,The New York Times,"A shooting during a high school football game on Friday night in New Jersey seriously injured 2 people, the police… https://t.co/XJA0wLuj8J",Sat Nov 16 04:10:07 +0000 2019,-0.5267,0.0,0.784,0.216
94,The New York Times,"Here is what we know so far about the shooting in Santa Clarita, California
https://t.co/15TCSicEo0",Sat Nov 16 04:00:03 +0000 2019,0.0,0.0,1.0,0.0
95,The New York Times,"9 new books recommended by critics and editors at The New York Times
https://t.co/LI7DlO53Ck",Sat Nov 16 03:40:01 +0000 2019,-0.1027,0.12,0.733,0.147
96,The New York Times,"RT @johnismay: Three judges in Indianapolis tried to visit a strip club, but it had just closed -- at 3 a.m. So they went to the White Cast…",Sat Nov 16 03:20:05 +0000 2019,0.0,0.0,1.0,0.0
97,The New York Times,"Our reporter @andylocal found work on an Amazon website — and made 97 cents an hour. Go inside the weird, wild, low… https://t.co/uqwiRJMR5s",Sat Nov 16 03:00:17 +0000 2019,0.0,0.073,0.855,0.073
98,The New York Times,North Carolina Democrats asked the same 3-judge panel of the state Superior Court to reject a new congressional map… https://t.co/st2marWLuY,Sat Nov 16 02:40:05 +0000 2019,0.2023,0.151,0.733,0.116
99,The New York Times,RT @David_Philipps: Trump just cleared three members of the military in war crimes cases. The moves show he intends to use his power as the…,Sat Nov 16 02:20:02 +0000 2019,-0.5423,0.049,0.813,0.138
100,Fox News,BREAKING: Federal appeals court rules against Trump administration on DACA https://t.co/KHnrNvEKAM,Thu Nov 08 19:18:44 +0000 2018,0.0,0.0,1.0,0.0
101,Fox News,"Breaking News: Grand jury indicts captain of Missouri duck boat that sank in severe weather, killing 17 people https://t.co/ffOOgzRwdo",Thu Nov 08 17:02:25 +0000 2018,-0.6124,0.115,0.615,0.269
102,Fox News,"JUST IN: Police identify gunman who opened fire inside California bar, killing 12 https://t.co/PvITYr54AX",Thu Nov 08 15:14:45 +0000 2018,-0.7783,0.0,0.638,0.362
103,Fox News,JUST IN: Supreme Court Justice Ruth Bader Ginsburg fractures 3 ribs in fall https://t.co/9UM9hKTz4m,Thu Nov 08 14:22:51 +0000 2018,0.7906,0.389,0.611,0.0
104,Fox News,"Sgt. Ron Helus was fatally shot when he responded to the mass shooting on Nov. 7 at a bar in Thousand Oaks, Califor… https://t.co/vOH3OWPN5S",Thu Nov 08 13:43:25 +0000 2018,-0.6369,0.0,0.833,0.167
105,Fox News,Tom Homan: “It’s a tragedy each and every time.” https://t.co/dMV68Hfdz0 https://t.co/hrq51VJg7x,Thu Nov 08 13:35:03 +0000 2018,-0.6597,0.0,0.672,0.328
106,Fox News,"People walk away from the scene in Thousand Oaks, Calif. where a gunman opened fire Wednesday.… https://t.co/O3Oo2iLL8O",Thu Nov 08 13:22:27 +0000 2018,-0.34,0.0,0.862,0.138
107,Fox News,Teylor Whittler describes what she witnessed at California bar shooting https://t.co/dMV68Hfdz0 https://t.co/YznTZgQoYY,Thu Nov 08 12:56:20 +0000 2018,0.0,0.0,1.0,0.0
108,Fox News,"An FBI agent talks to a potential witness as they stand near the scene in Thousand Oaks, Calif. where a gunman open… https://t.co/7QOmXNTYM0",Thu Nov 08 12:37:05 +0000 2018,0.0,0.0,1.0,0.0
109,Fox News,Ventura County Fire Department Captain Stan Ziegler: “Hundreds of first responders responded initially to the scene… https://t.co/o4gArhmy4e,Thu Nov 08 12:25:14 +0000 2018,-0.34,0.0,0.87,0.13
110,Fox News,"People comfort each other as they stand near the scene in Thousand Oaks, Calif. where a gunman opened fire during a… https://t.co/wPI4XSpirC",Thu Nov 08 12:06:14 +0000 2018,0.0258,0.105,0.795,0.1
111,Fox News,"California bar shooting leaves 12 dead, including sheriff's sergeant, police say https://t.co/dMV68Hfdz0 https://t.co/WvjarPpwPV",Thu Nov 08 11:54:22 +0000 2018,-0.6486,0.0,0.736,0.264
112,Fox News,"California bar shooting leaves 12 dead, including sheriff's sergeant, police say https://t.co/GqI77wMuYZ",Thu Nov 08 11:38:17 +0000 2018,-0.6486,0.0,0.719,0.281
113,Fox News,"Sheriff's deputies speak to potential witnesses as they stand near the scene in Thousand Oaks, Calif., where a gunm… https://t.co/jPE8k9oQHr",Thu Nov 08 11:32:26 +0000 2018,0.0,0.0,1.0,0.0
114,Fox News,13 dead in country music bar including gunman https://t.co/PvITYr54AX https://t.co/UURBIatqte,Thu Nov 08 11:26:46 +0000 2018,-0.6486,0.0,0.677,0.323
115,Fox News,"12 dead in shooting at Thousand Oaks nightclub, police say https://t.co/PvITYr54AX https://t.co/o8Nf8WuJcZ",Thu Nov 08 11:18:08 +0000 2018,-0.6486,0.0,0.719,0.281
116,Fox News,"Breaking News: At least 12 dead in shooting at Thousand Oaks nightclub, police say https://t.co/u6sVxdzHq5",Thu Nov 08 11:13:32 +0000 2018,-0.6486,0.0,0.765,0.235
117,Fox News,.@CarleyShimkus is live with the ‘Fox News Update’ on Facebook Watch: https://t.co/hNrB8xzepH https://t.co/cQ9uxkjUIK,Thu Nov 08 11:12:14 +0000 2018,0.0,0.0,1.0,0.0
118,Fox News,"Authorities deliver an update on the shooting in Thousand Oaks, California. (Courtesy: KABC) https://t.co/BtGxxIfNx5",Thu Nov 08 10:53:33 +0000 2018,0.0,0.0,1.0,0.0
119,Fox News,Pastor Dimas Salaberrios on California shooting: “My immediate thoughts go out to the families. Because what’s happ… https://t.co/iowf5VOL2l,Thu Nov 08 10:36:12 +0000 2018,0.0,0.0,1.0,0.0
120,CNN,"China has completed its first public test of a Mars lander, keeping the country on track for an unmanned exploratio… https://t.co/dQUNt5VmwE",Sat Nov 16 09:16:04 +0000 2019,0.0,0.0,1.0,0.0
121,CNN,A child prodigy from Belgium is on course to gain a bachelor's degree at the tender age of nine. He plans to embark… https://t.co/wTSpw6Gwaq,Sat Nov 16 09:01:04 +0000 2019,0.5267,0.139,0.861,0.0
122,CNN,"Here's what it's like to fly on the world's longest passenger flight, from London to Sydney in 19 hours and 19 minu… https://t.co/hwZzMDqS7o",Sat Nov 16 08:46:08 +0000 2019,0.3612,0.102,0.898,0.0
123,CNN,"Meet the gaming world's first transgender hero. ""Tell Me Why"" by Xbox Game Studios is the first video game by a maj… https://t.co/uRUipI2wD1",Sat Nov 16 08:31:03 +0000 2019,0.5574,0.146,0.854,0.0
124,CNN,"You can get paid $1,000 to binge watch 24 Hallmark Christmas movies in 12 days https://t.co/RloLTfelx3 https://t.co/469SbctMKo",Sat Nov 16 08:16:05 +0000 2019,0.0,0.0,1.0,0.0
125,CNN,Pope Francis said some of the things he's heard targeting Jews and the LGBTQ community remind him of the days of Ad… https://t.co/3bV1mIRFyJ,Sat Nov 16 08:01:07 +0000 2019,0.0,0.0,1.0,0.0
126,CNN,This is the world's largest Starbucks https://t.co/fZqY1X8b4H https://t.co/GPCLleq8qY,Sat Nov 16 07:46:06 +0000 2019,0.0,0.0,1.0,0.0
127,CNN,"Whether or not you can read and write could be a factor in your ability to stave off dementia as you grow older, ac… https://t.co/t4vCRv4udb",Sat Nov 16 07:39:09 +0000 2019,0.3182,0.091,0.909,0.0
128,CNN,"Meet Narwhal, a 10-week-old rescue puppy with a special tail on his forehead that has catapulted him to internet fa… https://t.co/MzaZ3UDDnI",Sat Nov 16 07:31:05 +0000 2019,0.7184,0.261,0.739,0.0
129,CNN,"Gunfire broke out at a high school football game in New Jersey on Friday night, sending terrified fans diving under… https://t.co/Xs4UbOzz2T",Sat Nov 16 07:21:25 +0000 2019,-0.7579,0.052,0.677,0.271
130,CNN,"Automotive company VinFast's first electric scooter, Klara, could create an environmentally friendly option for Han… https://t.co/SRey4VGuwq",Sat Nov 16 07:16:09 +0000 2019,0.6486,0.275,0.725,0.0
131,CNN,"Kateryna Handziuk, who died in 2018 following an acid attack, was brought up today because on April 25 — when Marie… https://t.co/puZ0fct3fE",Sat Nov 16 07:01:04 +0000 2019,-0.7717,0.0,0.739,0.261
