,tweet_source,tweet_text,tweet_date,tweet_vader_score,tweet_pos_score,tweet_neu_score,tweet_neg_score
392,The New York Times,"Twitter detailed its plans to ban political ads on Friday, but no matter what it does the platform faces criticism… https://t.co/50V4b63py3",Fri Nov 15 18:40:09 +0000 2019,-0.6059,0.047,0.742,0.21
393,The New York Times,"Our congressional correspondent @npfandos gives context to the line of questioning by Steve Castor, the Republican… https://t.co/0t2P743Ii1",Fri Nov 15 18:32:25 +0000 2019,-0.1027,0.0,0.92,0.08
394,The New York Times,"Our reporter went inside the weird, wild, low-wage world of Mechanical Turk, Amazon's platform for crowdwork or mic… https://t.co/85udGux4LA",Fri Nov 15 18:30:07 +0000 2019,-0.1779,0.0,0.914,0.086
395,The New York Times,"""The president in realtime is attacking you,"" Rep. Adam Schiff told Marie Yovanovitch as she testified. ""What effec… https://t.co/9JGe840bCM",Fri Nov 15 18:13:33 +0000 2019,-0.4588,0.0,0.857,0.143
396,The New York Times,"In his questioning, Steve Castor, Republican counsel, attempted to establish that Marie Yovanovitch doesn’t have di… https://t.co/xBXczGtPmV",Fri Nov 15 18:04:48 +0000 2019,-0.1027,0.0,0.92,0.08
397,The New York Times,Michael Bloomberg is poised to swamp the field with advertising. Deval Patrick has made clear that he aims to compe… https://t.co/DToWNfnBTb,Fri Nov 15 18:00:18 +0000 2019,0.5574,0.195,0.805,0.0
398,The New York Times,Here's everyone who's been charged in investigations related to the 2016 U.S. election https://t.co/18wiLhI0Kp,Fri Nov 15 17:45:30 +0000 2019,-0.2023,0.0,0.878,0.122
399,The New York Times,"Read Marie Yovanovitch's opening statements from today's impeachment hearing, in which she describes her family's h… https://t.co/51Hpcsdr4A",Fri Nov 15 17:40:10 +0000 2019,0.0,0.0,1.0,0.0
400,Fox News,.@POTUS: “Hopefully we can all work together next year to continue delivering for the American people.”… https://t.co/FdLczQZN4g,Thu Nov 08 05:01:00 +0000 2018,0.0,0.0,1.0,0.0
401,Fox News,Former US Attorney Harry Litman on Whitaker &amp; Mueller probe: “I think most people think it’s unlikely that he would… https://t.co/6W1eHbZ7zZ,Thu Nov 08 04:55:00 +0000 2018,0.0,0.0,1.0,0.0
402,Fox News,Pete Davidson's 'SNL' castmate Kenan Thompson talks Dan Crenshaw joke: 'They are figuring out a way to right that w… https://t.co/MlIJF907FK,Thu Nov 08 04:50:00 +0000 2018,0.296,0.104,0.896,0.0
403,Fox News,".@jasoninthehouse: “Attorney General @jeffsessions is a patriot. He was a good Republican, and I applaud him for hi… https://t.co/lqmOqmHcJZ",Thu Nov 08 04:45:00 +0000 2018,0.7096,0.296,0.704,0.0
404,Fox News,"Tom Dupree on Acting Attorney General Matthew Whitaker: “Calls for him to recuse from Russia, I think, are meritles… https://t.co/74TWeQngjg",Thu Nov 08 04:35:00 +0000 2018,0.0,0.0,1.0,0.0
405,Fox News,"Cabinet shakeup expected after @jeffsessions pushed out, @edhenry reports @foxnewsnight https://t.co/6UTwyCpZRV https://t.co/MY7kH6s4T7",Thu Nov 08 04:25:00 +0000 2018,-0.1531,0.0,0.873,0.127
406,Fox News,"New reactions to Sessions resignation, Catherine Herridge has the story @foxnewsnight https://t.co/6UTwyCHBgv https://t.co/FaiATyMSgC",Thu Nov 08 04:14:15 +0000 2018,-0.296,0.0,0.845,0.155
407,Fox News,MLB star @Bharper3407 rejects $300M offer from Nationals: Reports (via @FoxBusiness) https://t.co/Bgfoyi7fNH,Thu Nov 08 04:05:00 +0000 2018,-0.4939,0.0,0.775,0.225
408,Fox News,Doug Schoen: Trump shouldn’t have fired Jeff Sessions – here’s why https://t.co/0ITTpZyqyx,Thu Nov 08 03:55:00 +0000 2018,-0.5574,0.0,0.735,0.265
409,Fox News,"Joseph diGenova on who could replace AG Sessions: ""@ChrisChristie would have the full confidence of @POTUS, which i… https://t.co/3eoxyIurd3",Thu Nov 08 03:52:26 +0000 2018,0.5106,0.155,0.845,0.0
410,Fox News,‘Brady Bunch’ cast to take part in TV home’s renovation: report https://t.co/rebtV4qkql,Thu Nov 08 03:48:00 +0000 2018,0.0,0.0,1.0,0.0
411,Fox News,".@TuckerCarlson: Dems' Election Message Was All 'Trump', No Substance https://t.co/CscvHQkfAX",Thu Nov 08 03:42:00 +0000 2018,-0.296,0.0,0.804,0.196
412,Fox News,"11-year-old in North Carolina charged with putting needles in Halloween candy, police say https://t.co/Dm3F07wpIt",Thu Nov 08 03:35:00 +0000 2018,-0.2023,0.0,0.878,0.122
413,Fox News,Rhino rescue? Scientists may hold key to saving northern white rhinoceros from extinction  https://t.co/VUifTtCbTk,Thu Nov 08 03:29:00 +0000 2018,0.5106,0.202,0.798,0.0
414,Fox News,"RT @FoxBusiness: Rick Scott: ""Socialism will not happen in our nation, and it's not going to happen under my watch."" https://t.co/CLNOuNnGNo",Thu Nov 08 03:23:02 +0000 2018,0.0,0.0,1.0,0.0
415,Fox News,"Democrat Colin Allred, who unseated Rep. Pete Sessions, won't say if he'll back Pelosi https://t.co/mNox8bKgiA",Thu Nov 08 03:23:00 +0000 2018,0.0,0.0,1.0,0.0
416,Fox News,Surveillance video shows Michigan woman reportedly reversing car into store https://t.co/tJr2cUsZ8a,Thu Nov 08 03:16:01 +0000 2018,0.0,0.0,1.0,0.0
417,Fox News,".@senatemajldr Mitch McConnell said Wednesday that Democrats and Republicans will have to address health care ""on a… https://t.co/xF54bEhvOA",Thu Nov 08 03:11:00 +0000 2018,0.4939,0.158,0.842,0.0
418,Fox News,Woman finds her diamond before proposal and 'ring shames' herself https://t.co/uoLHUxHeBD,Thu Nov 08 03:04:00 +0000 2018,-0.0772,0.17,0.638,0.191
419,Fox News,McDonald's customers’ $5M lawsuit over unwanted Quarter Pounder cheese dismissed by judge https://t.co/yBEvL4cAFK,Thu Nov 08 03:01:47 +0000 2018,-0.4215,0.0,0.743,0.257
420,CNN,"In the weeks leading up to New Year’s Eve, @LisaLing embeds with the NYPD to find out what it takes to keep New Yor… https://t.co/GdWZOPpRDN",Sat Nov 16 01:00:14 +0000 2019,0.0,0.0,1.0,0.0
421,CNN,"As President Trump and his supporters seek to build expectations around the report, the Justice Department's inspec… https://t.co/OCfMS6RW0P",Sat Nov 16 00:59:33 +0000 2019,0.743,0.283,0.717,0.0
422,CNN,"Amazon is adding ""Amazon Pharmacy"" branding to PillPack, the mail-order pharmacy it acquired in 2018 https://t.co/8VXxlwHHxg",Sat Nov 16 00:47:52 +0000 2019,0.34,0.195,0.805,0.0
423,CNN,Pope Francis said some of the things he's heard targeting Jews and the LGBTQ community remind him of the days of Ad… https://t.co/8AxIBih9lX,Sat Nov 16 00:47:21 +0000 2019,0.0,0.0,1.0,0.0
424,CNN,Hulu is bumping the price of Hulu + Live TV by nearly 22 percent in its second price hike this year https://t.co/uj2bneR0lg,Sat Nov 16 00:44:41 +0000 2019,0.0,0.0,1.0,0.0
425,CNN,"President Trump intervened in three high-profile military criminal cases involving war crimes, a decision that igno… https://t.co/hJU6u9daVs",Sat Nov 16 00:19:24 +0000 2019,-0.8074,0.0,0.657,0.343
426,CNN,The Texas Court of Criminal Appeals blocked the execution of Rodney Reed. The court granted Reed's motion to stay t… https://t.co/f3i4CLLuQQ,Sat Nov 16 00:05:57 +0000 2019,-0.5423,0.078,0.706,0.216
427,CNN,Read State Department aide David Holmes' opening statement https://t.co/XHu7pEvqwd https://t.co/nsLBiEBuku,Fri Nov 15 23:52:56 +0000 2019,0.0,0.0,1.0,0.0
428,CNN,"David Holmes, testifying behind closed doors, backs up US diplomat Bill Taylor's version of the call between Presid… https://t.co/FE6PjsxQgH",Fri Nov 15 23:48:32 +0000 2019,-0.0516,0.0,0.938,0.062
429,CNN,"GOP Rep. Elise Stefanik of New York, a member of the House Intelligence Committee, has played a key role in this we… https://t.co/lLUswK5bfk",Fri Nov 15 23:43:50 +0000 2019,0.6705,0.224,0.776,0.0
430,CNN,An unflappable Marie Yovanovitch faces down President Trump's taunts | Analysis by CNN's @MaeveReston… https://t.co/V4Y1pLYTGd,Fri Nov 15 23:40:09 +0000 2019,0.0,0.0,1.0,0.0
431,CNN,"""Clearly [WeWork] is in desperate need of a turnaround, but Legere is not the right man for the job,"" Charles M. El… https://t.co/MKa8rJvrhM",Fri Nov 15 23:37:26 +0000 2019,0.0516,0.079,0.851,0.07
432,CNN,"Today ""will go down in history as day two of the public impeachment hearings of President Donald Trump, but it also… https://t.co/5tCtLtH6L5",Fri Nov 15 23:27:45 +0000 2019,0.0,0.0,1.0,0.0
433,CNN,"The ousted US ambassador to Ukraine testified Friday that she was ""shocked and devastated"" after learning that Pres… https://t.co/VWcFSLFrRg",Fri Nov 15 23:18:08 +0000 2019,-0.743,0.0,0.73,0.27
434,CNN,"President Trump says the economy is ""BOOMING."" But two newly published GDP models paint a starkly different picture… https://t.co/0I9aSmpaDa",Fri Nov 15 23:08:35 +0000 2019,0.0,0.0,1.0,0.0
435,CNN,"Kateryna Handziuk, who died in 2018 following an acid attack, was brought up today because on April 25 — when Marie… https://t.co/HIazJ5ghm6",Fri Nov 15 22:59:20 +0000 2019,-0.7717,0.0,0.739,0.261
436,CNN,While some cannabis businesses are hopeful of a market rebound — one even has its sights on a new public listing —… https://t.co/vGB77i1OOo,Fri Nov 15 22:50:30 +0000 2019,0.5106,0.148,0.852,0.0
437,CNN,The NFL has suspended Cleveland Browns defensive end Myles Garrett indefinitely — and at least for the rest of the… https://t.co/w9wvGQDcZr,Fri Nov 15 22:38:19 +0000 2019,-0.4588,0.05,0.811,0.14
438,CNN,"Britain's Prince Andrew, the Duke of York, said in an interview that he let the royal family down by associating hi… https://t.co/NQHXwNu6up",Fri Nov 15 22:31:11 +0000 2019,0.0,0.0,1.0,0.0
439,CNN,"In a historic move, President Trump announced that hospitals will be required to disclose the rates they privately… https://t.co/DDhUDqcIkJ",Fri Nov 15 22:20:48 +0000 2019,0.0,0.0,1.0,0.0
440,BBC News (World),Africa's top shots: 8-14 November 2019 https://t.co/ZL5rk4zTRV,Fri Nov 15 00:34:41 +0000 2019,0.2023,0.231,0.769,0.0
441,BBC News (World),Kenya's ugali scare: How safe is your maize flour? https://t.co/Z9AaCJh1qx,Fri Nov 15 00:32:20 +0000 2019,-0.0772,0.206,0.567,0.227
442,BBC News (World),The hacking threat to India's digital economy dream https://t.co/ZHb0IUwpXa,Fri Nov 15 00:29:56 +0000 2019,-0.34,0.161,0.565,0.274
443,BBC News (World),Emotional reunions after California school shooting https://t.co/2kPYXrOYFv https://t.co/D249kN7gpd,Fri Nov 15 00:17:35 +0000 2019,0.1531,0.186,0.814,0.0
444,BBC News (World),Hong Kong protests: Man dies amid clashes https://t.co/q3mddmLWsW,Fri Nov 15 00:13:53 +0000 2019,-0.2263,0.0,0.787,0.213
445,BBC News (World),Trump impeachment inquiry: Why Ukraine is so important to the US https://t.co/MEZEnN7Uze,Thu Nov 14 23:05:54 +0000 2019,0.3327,0.177,0.823,0.0
446,BBC News (World),"Manny MUA had it all – followers, sponsorships and fame, but then he was ‘cancelled’

A year later, he reflects on… https://t.co/MC93brXcUS",Thu Nov 14 23:04:23 +0000 2019,0.2382,0.093,0.907,0.0
447,BBC News (World),US silicone death: Briton Donna Francis sentenced to year in jail https://t.co/9UOI9R5HgL,Thu Nov 14 22:59:08 +0000 2019,-0.6124,0.0,0.667,0.333
448,BBC News (World),Watching impeachment hearing in Trump country https://t.co/RWCvr2BINK,Thu Nov 14 22:47:39 +0000 2019,0.0,0.0,1.0,0.0
449,BBC News (World),"Could air conditioning save the planet? 
[Tap to expand] https://t.co/TXJsaRsncy https://t.co/tflieM35JU",Thu Nov 14 21:39:24 +0000 2019,0.4939,0.242,0.758,0.0
450,BBC News (World),US gynaecologist 'performed hysterectomies without consent' https://t.co/81HlCBb4hH,Thu Nov 14 21:09:52 +0000 2019,-0.1695,0.0,0.783,0.217
451,BBC News (World),"RT @BBCBreaking: Two students have been killed and three others injured by 16-year-old who opened fire at school in California, officials s…",Thu Nov 14 20:32:08 +0000 2019,-0.8625,0.0,0.664,0.336
452,BBC News (World),White House hopeful Elizabeth Warren baits billionaires https://t.co/v1QanJYHl5,Thu Nov 14 20:30:36 +0000 2019,0.5106,0.32,0.68,0.0
453,BBC News (World),Trump impeachment inquiry: Right-wing media denounce 'boring' TV premiere https://t.co/zBNIGpuhAC,Thu Nov 14 19:30:32 +0000 2019,-0.34,0.0,0.789,0.211
454,BBC News (World),Ryan Straschnitzki: Paralysed hockey player moves his leg after surgery https://t.co/b8gtKK8lip,Thu Nov 14 19:07:43 +0000 2019,0.0,0.0,1.0,0.0
455,BBC News (World),Erdogan shows anti-Kurdish video to senators at White House https://t.co/bhWKKFEUs6,Thu Nov 14 18:11:04 +0000 2019,0.0,0.0,1.0,0.0
456,BBC News (World),Nasa probing oxygen mystery on Mars https://t.co/2cw1gYrSzA,Thu Nov 14 17:27:04 +0000 2019,0.0,0.0,1.0,0.0
457,BBC News (World),MH17 disaster: Phone-taps 'show Russia directed Ukraine rebels' https://t.co/fEqpLHam7a,Thu Nov 14 17:18:03 +0000 2019,-0.7096,0.0,0.543,0.457
458,BBC News (World),Australian bushfires: Why do people start fires during fires? https://t.co/DDXXDWES23,Thu Nov 14 17:12:45 +0000 2019,0.0,0.0,1.0,0.0
459,BBC News (World),Several injured in California school shooting https://t.co/ZgbUQJqMpq,Thu Nov 14 16:49:24 +0000 2019,-0.4019,0.0,0.69,0.31
460,CBS News,"RT @NicoleSganga: Conversations with half a dozen of Andrew Yang's high school friends reveal a rebellious teen, albeit the kind that still…",Fri Nov 15 18:23:04 +0000 2019,0.6486,0.253,0.661,0.086
461,CBS News,"Yovanovitch shoots down claims of a Ukrainian ""plan"" or ""plot"" against Trump: ""People are critical, and that does n… https://t.co/2Aygd06wRs",Fri Nov 15 18:22:32 +0000 2019,-0.3182,0.0,0.887,0.113
462,CBS News,Banksy artwork of a refugee in a life jacket is now under floodwater in Venice https://t.co/3AGsSLOWRl https://t.co/c9o5MgRGxM,Fri Nov 15 18:19:30 +0000 2019,0.0,0.0,1.0,0.0
463,CBS News,"Yovanovitch says she never met or talked to Hunter Biden, and sidesteps question about whether he got on the Burism… https://t.co/smug8viuFc",Fri Nov 15 18:07:53 +0000 2019,0.0,0.0,1.0,0.0
464,CBS News,"Pornography can be damaging, especially for those who “probably aren’t mature enough to process what they’re seeing… https://t.co/juzSRhyGD7",Fri Nov 15 18:00:27 +0000 2019,-0.128,0.127,0.724,0.149
465,CBS News,"Rep. Devin Nunes says the House Intelligence Committee has become the ""House Impeachment Committee"" and that Yovano… https://t.co/8sPribHKlQ",Fri Nov 15 17:46:42 +0000 2019,0.4767,0.154,0.846,0.0
466,CBS News,"Yovanovitch says rumors of her removal undermined the U.S. position with Ukraine: ""The Ukrainians didn't know what… https://t.co/Ebu0srEqlZ",Fri Nov 15 17:45:15 +0000 2019,-0.3612,0.0,0.872,0.128
467,CBS News,"Meet Mutley, the dog who crashed a stranger's wedding and helped solve his master's murder https://t.co/Px4CsD0TAJ https://t.co/lGcHHN3tPN",Fri Nov 15 17:39:33 +0000 2019,-0.5994,0.088,0.683,0.229
468,CBS News,Marie Yovanovitch's hearing has resumed. Watch live and follow our updates: https://t.co/qNx16IztcL https://t.co/d51OU14eqX,Fri Nov 15 17:24:17 +0000 2019,0.0,0.0,1.0,0.0
469,CBS News,BREAKING: Cleveland Browns' Myles Garrett has been suspended indefinitely by the NFL after helmet hit and fight dur… https://t.co/d8j18MA3XV,Fri Nov 15 17:16:44 +0000 2019,-0.6908,0.0,0.749,0.251
470,CBS News,RT @edokeefe: Here’s a list of the charges against Roger Stone via @AmberAliNews: https://t.co/0h1miICRh6,Fri Nov 15 16:58:11 +0000 2019,-0.2732,0.0,0.851,0.149
471,CBS News,"BREAKING: Roger Stone, a former Trump campaign adviser, has been found guilty on all seven counts… https://t.co/AG5vE6BWs3",Fri Nov 15 16:57:06 +0000 2019,-0.4215,0.0,0.843,0.157
472,CBS News,"RT @margbrennan: Notable excerpt from @realDonaldTrump in April 21 call with Ukraine's Zelensky: ""...When I owned Miss Universe, they alway…",Fri Nov 15 16:47:03 +0000 2019,-0.1531,0.0,0.918,0.082
473,CBS News,"Disparity in home lending costs minorities millions, researchers find https://t.co/XgWs7Zv8mx https://t.co/GYI7YuwsaG",Fri Nov 15 16:39:39 +0000 2019,0.0,0.0,1.0,0.0
474,CBS News,"CBSN legal contributor Keir Dougall on Trump's tweet attacking Yovanovitch during her hearing: ""Unfortunately for P… https://t.co/Y4UuyQjQzZ",Fri Nov 15 16:34:50 +0000 2019,-0.5994,0.072,0.67,0.258
475,CBS News,Dangerous air pollution in India forces Delhi schools to close for 2nd time in 2 weeks https://t.co/55wHo9Bzxc https://t.co/ZhFwbSQ3pw,Fri Nov 15 16:19:40 +0000 2019,-0.4767,0.0,0.838,0.162
476,CBS News,.@PaulaReidCBS breaks down President Trump's Twitter strategy for the impeachment hearings — and how his tweets cou… https://t.co/BSm6tZMZXk,Fri Nov 15 16:01:16 +0000 2019,0.0,0.0,1.0,0.0
477,CBS News,Millennials turning to astrology to combat stress https://t.co/2YLedWWxYr https://t.co/MryK471pxp,Fri Nov 15 15:59:49 +0000 2019,-0.6369,0.0,0.574,0.426
478,CBS News,.@edokeefe says a senior Republican aide told him President Trump's tweet criticizing Yovanovitch during her hearin… https://t.co/de2kW3AHND,Fri Nov 15 15:54:59 +0000 2019,-0.3612,0.0,0.857,0.143
479,CBS News,".@nancycordes on Yovanovitch's testimony about her removal: ""I don't think I've ever seen anything quite like this… https://t.co/TADUaEsjJJ",Fri Nov 15 15:49:01 +0000 2019,0.4201,0.141,0.859,0.0
480,The New York Times,The bitter fight between Taylor Swift and the men she said were controlling her most recognizable music has ratchet… https://t.co/FmV8cJHuvW,Fri Nov 15 17:30:07 +0000 2019,-0.5574,0.074,0.702,0.223
481,The New York Times,"After a brief recess, Marie Yovanovitch is testifying again in the impeachment hearing. Watch our live stream and f… https://t.co/c8RdR0PO3I",Fri Nov 15 17:28:51 +0000 2019,0.0,0.0,1.0,0.0
482,The New York Times,A controversy over accusations of unwanted touching by a male contestant has created a backlash among fans of the l… https://t.co/VyAyHjq3oy,Fri Nov 15 17:15:03 +0000 2019,-0.296,0.094,0.708,0.198
483,The New York Times,The Cleveland Browns star Myles Garrett was suspended indefinitely for pulling off the helmet of a rival quarterbac… https://t.co/T6qVpa12cH,Fri Nov 15 17:11:03 +0000 2019,-0.4767,0.0,0.846,0.154
484,The New York Times,President Trump denigrated Marie Yovanovitch on Twitter even as she testified about how she felt threatened by Trum… https://t.co/HW7G39WiX7,Fri Nov 15 17:00:04 +0000 2019,-0.4588,0.0,0.857,0.143
485,The New York Times,"Breaking News: Roger Stone, a friend of President Trump, was found guilty in a trial that revived the saga of Russi… https://t.co/BoN4q3Y1bu",Fri Nov 15 16:50:21 +0000 2019,0.1027,0.133,0.75,0.117
486,The New York Times,"RT @shearm: LATEST -- Here's our latest on the decision by @realDonaldTrump to denigrate Marie Yovanovitch, his former ambassador to Ukrain…",Fri Nov 15 16:44:12 +0000 2019,0.0,0.0,1.0,0.0
487,The New York Times,The Trump administration is proposing policies aimed at helping patients shop for better prices at hospitals. A leg… https://t.co/rbRoN0Bowm,Fri Nov 15 16:30:07 +0000 2019,0.6249,0.242,0.758,0.0
488,The New York Times,Who is Marie Yovanovitch and why is she relevant to the impeachment inquiry? Here’s what to know.… https://t.co/eEMgcwaQLJ,Fri Nov 15 16:22:03 +0000 2019,0.0,0.0,1.0,0.0
489,The New York Times,"""It sounded like a threat."" 

Marie Yovanovitch, the former U.S. ambassador to Ukraine, describes her reaction to P… https://t.co/TLqlTBCXwP",Fri Nov 15 16:13:11 +0000 2019,0.3612,0.128,0.872,0.0
490,The New York Times,"A new bill in Congress, being introduced a day after 2 students were killed in a school shooting in California, wou… https://t.co/uniHclrtEY",Fri Nov 15 16:00:11 +0000 2019,-0.6705,0.0,0.791,0.209
491,The New York Times,Conservative allies of President Trump have settled on a message to dismiss the impeachment inquiry against him: Th… https://t.co/2h6pZDkGr3,Fri Nov 15 15:53:06 +0000 2019,0.0,0.0,1.0,0.0
492,The New York Times,"RT @andylocal: There’s a place on the internet where anyone can find work. It’s run by Amazon, it’s called Mechanical Turk, and you don’t n…",Fri Nov 15 15:30:40 +0000 2019,0.1779,0.069,0.931,0.0
493,The New York Times,"In her testimony, Marie Yovanovitch said that President Trump’s statements about her “sounded like a threat.""… https://t.co/kEbZxUdsk7",Fri Nov 15 15:27:30 +0000 2019,0.3612,0.143,0.857,0.0
494,The New York Times,"Read the White House's memo of Trump's April call with Zelensky. The document warns its contents are ""not a verbati… https://t.co/Fux98nuiBP",Fri Nov 15 15:27:30 +0000 2019,-0.1027,0.0,0.931,0.069
495,The New York Times,The White House released on Friday a memo of President Trump's congratulatory call from April with President Zelens… https://t.co/CZDETkVOsN,Fri Nov 15 15:26:07 +0000 2019,0.0,0.0,1.0,0.0
496,The New York Times,"""Our Ukraine policy has been thrown into disarray, and shady interests the world over have learned how little it ta… https://t.co/mHzenBn5Kc",Fri Nov 15 15:15:18 +0000 2019,0.25,0.091,0.909,0.0
497,The New York Times,The competition to get into New York City’s top public high schools — one has admissions rates roughly akin to Yale… https://t.co/DZruqSpgFv,Fri Nov 15 15:00:39 +0000 2019,0.2023,0.083,0.917,0.0
498,The New York Times,Marie Yovanovitch is potentially a more problematic witness for Republicans because she can say she was personally… https://t.co/YbfICjpad2,Fri Nov 15 15:00:02 +0000 2019,-0.4927,0.0,0.834,0.166
499,The New York Times,"Marie Yovanovitch ""was considered an obstacle to the furtherance of the president's personal and political agenda,""… https://t.co/GP86DHoIhU",Fri Nov 15 14:48:31 +0000 2019,-0.3612,0.0,0.865,0.135
