,tweet_source,tweet_text,tweet_date,tweet_vader_score,tweet_pos_score,tweet_neu_score,tweet_neg_score
263,CBS News,"Taylor Swift says she's being blocked from singing her songs at American Music Awards, a claim her old label, Big M… https://t.co/VMjEKnB36K",Fri Nov 15 23:00:23 +0000 2019,0.4019,0.193,0.723,0.084
264,CBS News,Democrats in 1998 and Republicans in 2019 use the same terms to attack impeachment https://t.co/1miygGG9rY https://t.co/R9d1ZCJdOE,Fri Nov 15 22:53:56 +0000 2019,-0.4767,0.0,0.829,0.171
265,CBS News,“Democrats seem very pleased”: @nikolendc says Democrats feel Yovanovitch came off as a very credible witness… https://t.co/mzs1KOFMg2,Fri Nov 15 22:40:45 +0000 2019,0.0,0.0,1.0,0.0
266,CBS News,Texas parole board recommends delaying Rodney Reed's execution amid mounting public support https://t.co/Hbxucq0Joi https://t.co/8axujKE0IB,Fri Nov 15 22:39:44 +0000 2019,0.5574,0.277,0.723,0.0
267,CBS News,Could longtime Trump aid Roger Stone — who was found guilty on all seven charges — be pardoned?… https://t.co/IY9VyqBArU,Fri Nov 15 22:37:11 +0000 2019,-0.5994,0.0,0.754,0.246
268,CBS News,"Astronauts to perform ""open heart surgery"" on cosmic ray detector in complex spacewalk https://t.co/UcnQEs17AW https://t.co/sIgbmliYxg",Fri Nov 15 22:19:32 +0000 2019,0.0,0.0,1.0,0.0
269,CBS News,Democrats claim Pres. Trump engaged in witness intimidation after attacks on Yovanovitch https://t.co/1miygGG9rY https://t.co/R8DH3n1T3q,Fri Nov 15 22:17:18 +0000 2019,-0.4588,0.139,0.567,0.294
270,CBS News,“The president made a mistake”: House Speaker Nancy Pelosi criticized Pres. Trump’s decision to tweet during today’… https://t.co/yAOoqeE7Ii,Fri Nov 15 22:13:00 +0000 2019,-0.3612,0.0,0.865,0.135
271,CBS News,"RT @CBSNewsRadio: NEW @TakeoutPodcast with @MajorCBS &amp; @RepRaskin👇

▪️ Tensions between Democrats &amp; Republicans
▪️ Ongoing impeachment inqu…",Fri Nov 15 22:11:36 +0000 2019,-0.4019,0.0,0.886,0.114
272,CBS News,"FDA warns Dollar Tree it's selling ""potentially unsafe drugs"" https://t.co/3g5xBVB8Ou https://t.co/LnBnts91Sp",Fri Nov 15 22:00:01 +0000 2019,-0.1027,0.0,0.877,0.123
273,CBS News,"""I was shocked and devastated"": Marie Yovanovitch, the former U.S. ambassador to Ukraine, testified Friday that Pre… https://t.co/QEGxhwqLWl",Fri Nov 15 21:39:55 +0000 2019,-0.3182,0.0,0.881,0.119
274,CBS News,"For Andrew Yang, New Hampshire is a ""homecoming"" and a big bet https://t.co/huEJFiLhxY https://t.co/JAD5Z3mGcP",Fri Nov 15 21:19:39 +0000 2019,0.0,0.0,1.0,0.0
275,CBS News,Staffer who overheard Trump call with Sondland testifies in closed hearing https://t.co/CX9DDyKmgt https://t.co/4fsV2i6Qn2,Fri Nov 15 21:00:00 +0000 2019,0.0,0.0,1.0,0.0
276,CBS News,"RT @CBSEveningNews: WATCH: David Holmes, a staffer at the U.S. Embassy in Kiev who told Amb. Bill Taylor that he overheard Pres. Trump spea…",Fri Nov 15 20:45:55 +0000 2019,0.0,0.0,1.0,0.0
277,CBS News,"Rep. Elise Stefanik says she disagrees with the ""tone"" of President Trump's tweet about Yovanovitch but says tweets… https://t.co/0uirab36br",Fri Nov 15 20:45:04 +0000 2019,-0.1655,0.0,0.916,0.084
278,CBS News,Comedian Mo'Nique accuses Netflix of discrimination https://t.co/WHFaMek8d1 https://t.co/BleLNamPt3,Fri Nov 15 20:39:37 +0000 2019,0.0516,0.236,0.545,0.218
279,CBS News,"Schiff tells @edokeefe about Trump's Yovanovitch tweet: ""This is a part of a pattern to intimidate witnesses. And i… https://t.co/CUmH2jAS9H",Fri Nov 15 20:36:49 +0000 2019,-0.2023,0.0,0.904,0.096
280,The New York Times,Evening Briefing: Here's what you need to know at the end of the day https://t.co/byH6DjIac9,Sat Nov 16 02:00:07 +0000 2019,0.0,0.0,1.0,0.0
281,The New York Times,From @nytparenting: Research suggests that drug-resistant infections among children are on the rise. Here’s how you… https://t.co/94dIIfjIvt,Sat Nov 16 01:42:03 +0000 2019,0.0,0.0,1.0,0.0
282,The New York Times,"Breaking News: The student who killed 2 of his classmates in a shooting at a Santa Clarita, California, high school… https://t.co/3OpjjG5TPQ",Sat Nov 16 01:25:01 +0000 2019,-0.6705,0.0,0.791,0.209
283,The New York Times,"RT @llerer: Obama wades into the 2020 race, warning of the dangers of listening to “certain left-leaning twitter feeds” or “the activist wi…",Sat Nov 16 01:20:03 +0000 2019,-0.6808,0.0,0.789,0.211
284,The New York Times,3 proposals have emerged as possible next chapters for Rikers: turning it into a renewable energy hub; adding a run… https://t.co/Ev47baDDr9,Sat Nov 16 01:00:09 +0000 2019,0.2732,0.11,0.89,0.0
285,The New York Times,"RT @NickAtNews: NEW: No manifesto, diary, or suicide note found in the Santa Clarita high school shooting.

Police do not know why a 16yo.…",Sat Nov 16 00:52:39 +0000 2019,-0.7717,0.0,0.758,0.242
286,The New York Times,"As Marie Yovanovitch, the former ambassador to Ukraine, testified on the second day of public impeachment hearings,… https://t.co/oQ8TKh1Ds5",Sat Nov 16 00:40:03 +0000 2019,0.0,0.0,1.0,0.0
287,The New York Times,"RT @tarasbernard: It's FAFSA season, that time of year when families learn how much they're expected to pay for college. But that figure is…",Sat Nov 16 00:20:04 +0000 2019,-0.0516,0.0,0.95,0.05
288,The New York Times,"“I knew it was just a shirt. But the longer I left it there, the more it grew into a symbol of something bigger.“ https://t.co/a88bWIl2fQ",Sat Nov 16 00:10:03 +0000 2019,0.0,0.0,1.0,0.0
289,The New York Times,"Breaking News: President Trump, overruling military leaders, cleared 3 service members accused of war crimes, inclu… https://t.co/55eNy7soQD",Fri Nov 15 23:55:06 +0000 2019,-0.6908,0.068,0.634,0.298
290,The New York Times,Evening Briefing: Here's what you need to know at the end of the day https://t.co/MPb7UUktNQ,Fri Nov 15 23:40:04 +0000 2019,0.0,0.0,1.0,0.0
291,The New York Times,Want to know if there might be a camera where it shouldn’t be? It’s not paranoid to take precautions and check your… https://t.co/V4s5hFqV4S,Fri Nov 15 23:20:05 +0000 2019,0.2593,0.132,0.868,0.0
292,The New York Times,Getting together with a local on a trip abroad can take you beyond the tourist sites and Instagram opportunities. H… https://t.co/NArTDp732J,Fri Nov 15 23:00:15 +0000 2019,0.3818,0.126,0.874,0.0
293,The New York Times,President Trump tweeted attacks about Marie Yovanovitch as she testified publicly in the impeachment inquiry on Fri… https://t.co/nH4dFZYUG1,Fri Nov 15 22:36:43 +0000 2019,-0.4404,0.0,0.854,0.146
294,The New York Times,"RT @SherylNYT: ""Shocked, appalled, devastated."" That's how Marie Yovanovitch felt after she learned President Trump told the president of U…",Fri Nov 15 22:22:22 +0000 2019,-0.4588,0.0,0.864,0.136
295,The New York Times,Critic’s Notebook: A mid-hearing Twitter attack from President Trump made its way into Marie Yovanovitch’s testimon… https://t.co/cWdfTjm8Sl,Fri Nov 15 22:00:12 +0000 2019,-0.4767,0.0,0.829,0.171
296,The New York Times,"For teens who've grown up online, the internet is a space for reinvention. “We all contain multitudes. The kids see… https://t.co/zhjQk6zkrh",Fri Nov 15 21:45:06 +0000 2019,0.0,0.0,1.0,0.0
297,The New York Times,"In a devastating indictment of foreign policy in the Trump era, Marie Yovanovitch outlined the harm to U.S. diploma… https://t.co/Zrtx2fB57U",Fri Nov 15 21:15:06 +0000 2019,-0.8316,0.0,0.685,0.315
298,The New York Times,RT @dougmillsnyt: .@realDonaldTrump's tweet is shown on a TV as Former Ambassador to Ukraine Marie Yovanovitch looks on as she appears befo…,Fri Nov 15 21:06:12 +0000 2019,0.0,0.0,1.0,0.0
299,The New York Times,"The hearing room breaks into applause for Marie Yovanovitch, the former U.S. ambassador to Ukraine, at the conclusi… https://t.co/KAnF0wz0Ud",Fri Nov 15 21:00:46 +0000 2019,0.4215,0.135,0.865,0.0
300,Fox News,"Devotees lit earthen lamps in Ayodhya, India as part of Diwali celebrations, also known as a festival of lights, on… https://t.co/uWGZnrkvqD",Thu Nov 08 07:51:00 +0000 2018,0.5719,0.207,0.793,0.0
301,Fox News,".@TGowdySC on Jeff Sessions resigning: ""It was going to happen...He's been a proverbial dead man walking for severa… https://t.co/ojKL4KMFTz",Thu Nov 08 07:41:00 +0000 2018,-0.7351,0.0,0.721,0.279
302,Fox News,Mob chants threats outside @TuckerCarlson’s DC home https://t.co/IJE8m5gjWi,Thu Nov 08 07:31:00 +0000 2018,-0.4215,0.0,0.714,0.286
303,Fox News,".@TuckerCarlson: ""Supporting marriage and children is the best, maybe the only way, for Republicans or any of us to… https://t.co/fqPwC8XTaY",Thu Nov 08 07:21:00 +0000 2018,0.7964,0.283,0.717,0.0
304,Fox News,.@KennedyNation: Dems in 2020 better without Nancy https://t.co/54vTCiffG4,Thu Nov 08 07:16:00 +0000 2018,0.4404,0.293,0.707,0.0
305,Fox News,Battleground-state Dems who opposed Kavanaugh all defeated https://t.co/guqMSVjd74,Thu Nov 08 07:11:00 +0000 2018,-0.4767,0.0,0.693,0.307
306,Fox News,".@Jim_Jordan on his run for House GOP leader: “We have to match [@POTUS’s] intensity, that’s what I want to do. If… https://t.co/2VOW1ykCsI",Thu Nov 08 07:01:00 +0000 2018,0.0772,0.061,0.939,0.0
307,Fox News,.@senatemajldr: Dem Votes Against Kavanaugh Were a 'Godsend' to GOP in Midterms https://t.co/ietr8sP4EQ,Thu Nov 08 06:51:00 +0000 2018,0.0,0.0,1.0,0.0
308,Fox News,.@marcthiessen: “There’s lots of things that Democrats could take a stand on that they find inherently unacceptable… https://t.co/c7UFDzFd60,Thu Nov 08 06:41:00 +0000 2018,0.0,0.0,1.0,0.0
309,Fox News,".@DarrellIssa on the Mueller probe: ""Two years is a long time to look for a crime you can't prove.""… https://t.co/plX9kxpSXy",Thu Nov 08 06:36:00 +0000 2018,-0.5423,0.0,0.829,0.171
310,Fox News,"Second teen dies of gunshot wound after Oklahoma mom's rampage, authorities say https://t.co/VUQxsa3mq3",Thu Nov 08 06:31:00 +0000 2018,0.0,0.0,1.0,0.0
311,Fox News,.@marcthiessen: “The president today made very clear that he wants to cut deals with the Democrats. And quite frank… https://t.co/MGVdJQVfUt,Thu Nov 08 06:21:00 +0000 2018,0.2006,0.126,0.783,0.091
312,Fox News,"Florida Highway Patrol cruiser hits 142 mph in pursuit, catches on fire https://t.co/GqWKI45AAm",Thu Nov 08 06:11:00 +0000 2018,-0.34,0.0,0.833,0.167
313,Fox News,Democratic strategist @LeslieMarshall: “What we need is not a wall — and not a wall that we can’t afford — but comp… https://t.co/TzRWVJQeVv,Thu Nov 08 06:01:00 +0000 2018,0.0,0.0,1.0,0.0
314,Fox News,"Sex offender gets 22 years after missing boy, 14, found in his room at halfway house, authorities say https://t.co/sDd0VQzob4",Thu Nov 08 05:51:00 +0000 2018,-0.5719,0.0,0.783,0.217
315,Fox News,".@POTUS touts Senate gains, @LelandVittert breaks down the results @foxnewsnight https://t.co/VMzif8sgHH",Thu Nov 08 05:41:00 +0000 2018,0.3182,0.192,0.72,0.088
316,Fox News,Former Kavanaugh colleague among group being considered to replace Sessions as AG: reports https://t.co/HxAlDZx2Mg,Thu Nov 08 05:31:00 +0000 2018,0.0,0.0,1.0,0.0
317,Fox News,"Too close to call: Meticulous vote count transpiring in Arizona Senate race, @aacuna1 reports @foxnewsnight https://t.co/DV6EX4Ogxe",Thu Nov 08 05:26:00 +0000 2018,0.0,0.0,1.0,0.0
318,Fox News,"Former SEAL Mocked by 'SNL' Wins TX House Seat, Calls for More Vets in Congress https://t.co/T0PAhopphH… https://t.co/qhS5BVOE2U",Thu Nov 08 05:21:01 +0000 2018,0.6841,0.298,0.603,0.099
319,Fox News,South Carolina voter told to remove 'Trump' shirt in order to vote: report https://t.co/xWY2EdSpDF,Thu Nov 08 05:11:00 +0000 2018,0.0,0.0,1.0,0.0
320,CNN,Labor talks between Fiat Chrysler and the United Auto Workers union get underway in earnest next week https://t.co/enZw8bylGj,Sat Nov 16 03:25:12 +0000 2019,0.7269,0.276,0.724,0.0
321,CNN,"Whether or not you can read a write could be a factor in your ability to stave off dementia as you grow older, acco… https://t.co/Tx2JRPXAlR",Sat Nov 16 03:16:04 +0000 2019,0.3182,0.095,0.905,0.0
322,CNN,"Former President Barack Obama urged the field of Democratic presidential hopefuls to ""pay some attention to where v… https://t.co/jNV4sjY9Ap",Sat Nov 16 03:05:29 +0000 2019,-0.1027,0.0,0.928,0.072
323,CNN,"When Monica Gutierrez sent Ashton Kutcher a text and asked him to help her son's cross-country team get new shoes,… https://t.co/seenvS3Sgq",Sat Nov 16 02:57:29 +0000 2019,0.4019,0.124,0.876,0.0
324,CNN,People with Android phones in the United States will now be able to opt into the new texting service that Google ca… https://t.co/0xslOlVvtW,Sat Nov 16 02:53:45 +0000 2019,0.4215,0.113,0.887,0.0
325,CNN,"Exclusive: After a private White House meeting, Giuliani associate Lev Parnas said he was on a ""secret mission"" for… https://t.co/VXFFI0MHyT",Sat Nov 16 02:47:58 +0000 2019,0.128,0.081,0.919,0.0
326,CNN,"WeWork, the co-working startup on unsteady financial footing, is spending $438 million to renovate a building in Ne… https://t.co/4EpZ5kWNIy",Sat Nov 16 02:43:37 +0000 2019,0.0,0.0,1.0,0.0
327,CNN,"""I view this as a major development, this is another very credible witness...who heard the President's voice with h… https://t.co/JaI7sAFzOQ",Sat Nov 16 02:40:56 +0000 2019,0.0,0.0,1.0,0.0
328,CNN,"Former US Ambassador to Ukraine Marie Yovanovitch testified publicly, telling her story about how President Trump r… https://t.co/iKq4Q4Qc3k",Sat Nov 16 02:37:44 +0000 2019,0.0,0.0,1.0,0.0
329,CNN,"Exclusive: Giuliani associate Lev Parnas said that after a private meeting in the White House, he was on a ""secret… https://t.co/0wqHCgW6S1",Sat Nov 16 02:10:05 +0000 2019,0.128,0.077,0.923,0.0
330,CNN,"Bill Gates has surpassed Amazon CEO Jeff Bezos to reclaim the distinction of richest person in the world, with a ne… https://t.co/px0YNqVbxK",Sat Nov 16 02:01:57 +0000 2019,0.6249,0.212,0.788,0.0
331,CNN,"""This has to be the worst day of the presidency so far for Donald Trump... this is the worst day,"" says David Gerge… https://t.co/Fi3mbJ5Vma",Sat Nov 16 02:00:07 +0000 2019,-0.8481,0.0,0.728,0.272
332,CNN,"President Trump granted full pardons to Army 1st Lt. Clint Lorance and Army Major Mathew Golsteyn.

He also restore… https://t.co/CT0KLpPDk5",Sat Nov 16 01:59:16 +0000 2019,0.4939,0.189,0.811,0.0
333,CNN,"In closed-door testimony as part of the impeachment inquiry, David Holmes told lawmakers that Gordon Sondland had t… https://t.co/sC6fRuDpNh",Sat Nov 16 01:50:27 +0000 2019,0.0,0.0,1.0,0.0
334,CNN,The House Ethics Committee released updates on their investigations into four lawmakers. Here are the details on th… https://t.co/HcYYoWE2bg,Sat Nov 16 01:44:30 +0000 2019,0.0,0.0,1.0,0.0
335,CNN,"The suspected killer in the California school shooting has died, officials say https://t.co/hUZe7i60qO",Sat Nov 16 01:41:08 +0000 2019,-0.8689,0.0,0.505,0.495
336,CNN,Here are three questions raised by the newly released rough transcript of President Trump's first call with Ukraini… https://t.co/UXiMDafxTJ,Sat Nov 16 01:32:09 +0000 2019,0.0,0.0,1.0,0.0
337,CNN,Asked about the discrepancy between the April readout of Trump's phone call with the Ukrainian President and the ro… https://t.co/IViVQGBGyh,Sat Nov 16 01:24:04 +0000 2019,0.0,0.0,1.0,0.0
338,CNN,"Attorney General William Barr defended presidential power in a fiery speech to the conservative Federalist Society,… https://t.co/ljFmhXFCy0",Sat Nov 16 01:07:29 +0000 2019,-0.34,0.0,0.862,0.138
339,CNN,"""It didn't work,"" says @RepSwalwell of President Trump's attempts to intimidate Marie Yovanovitch.

She ""proved her… https://t.co/3Uz4HkPzWz",Sat Nov 16 01:00:54 +0000 2019,-0.2023,0.0,0.899,0.101
340,BBC News (World),"Frozen 2: Sequel warms some film critics' hearts, but others stay ice cool ❄️❄️ 

https://t.co/a0iKdO5iJh",Fri Nov 15 12:33:53 +0000 2019,0.4404,0.249,0.663,0.088
341,BBC News (World),Climate change: Warming signal links global floods and fires https://t.co/0qVmr2kOBo,Fri Nov 15 12:12:51 +0000 2019,0.1531,0.151,0.849,0.0
342,BBC News (World),Russians pardoned in Lithuania paving way for spy swap https://t.co/N81WJksVyK,Fri Nov 15 11:16:09 +0000 2019,0.2263,0.174,0.826,0.0
343,BBC News (World),"""I've never been to school because my family was poor""

South Korea has one of the lowest birth rates in the world,… https://t.co/Q9D2MCF04O",Fri Nov 15 11:06:21 +0000 2019,-0.6908,0.0,0.787,0.213
344,BBC News (World),Flooded Venice battles with new tidal surge https://t.co/QpEkWEcGSR,Fri Nov 15 11:01:01 +0000 2019,-0.3818,0.0,0.729,0.271
345,BBC News (World),SA post office rapist and murderer given life https://t.co/1QrvF8TTNp,Fri Nov 15 11:00:53 +0000 2019,-0.8885,0.0,0.424,0.576
346,BBC News (World),"RT @BBCSteveR: Today’s pro-Kremlin press portrays Russia as a strong country (Putin on the world stage, “naval power growing”). Other paper…",Fri Nov 15 10:46:40 +0000 2019,0.5106,0.148,0.852,0.0
347,BBC News (World),Bolivia crisis: Morales 'should be prosecuted' upon return https://t.co/svPHbmdvap,Fri Nov 15 10:36:12 +0000 2019,-0.7717,0.0,0.511,0.489
348,BBC News (World),Israel-Gaza ceasefire strained by rockets and air strikes https://t.co/oQKXJQIjZX,Fri Nov 15 09:46:24 +0000 2019,-0.6369,0.0,0.574,0.426
349,BBC News (World),How did Vodafone lose $7bn in India in just one quarter? https://t.co/BVGU1bqbTO,Fri Nov 15 09:40:36 +0000 2019,-0.4019,0.0,0.803,0.197
350,BBC News (World),Chile singer exposes breasts in protest at Latin Grammys https://t.co/d5OnfFhx1J,Fri Nov 15 09:33:06 +0000 2019,-0.3612,0.0,0.696,0.304
351,BBC News (World),Maria Bailey: Swing fall case TD deselected by Fine Gael https://t.co/KtJwG50xG9,Fri Nov 15 09:08:33 +0000 2019,0.2023,0.153,0.847,0.0
352,BBC News (World),"RT @BBCMaryam: A new study suggests long meetings at work are more about ‘therapy rather than solutions’, we want to know, do you think mee…",Fri Nov 15 07:39:55 +0000 2019,0.0772,0.053,0.947,0.0
353,BBC News (World),RT @BBCWorld: Hong Kong protests: Man dies amid clashes https://t.co/q3mddmLWsW,Fri Nov 15 07:15:55 +0000 2019,-0.2263,0.0,0.826,0.174
354,BBC News (World),RT @BBCNews: MH17 disaster: Phone-taps 'show Russia directed Ukraine rebels' https://t.co/swWon74fkS,Fri Nov 15 07:15:30 +0000 2019,-0.7096,0.0,0.604,0.396
355,BBC News (World),Dublin: Gove and Sturgeon at British-Irish Council meeting https://t.co/czDEfn6Nvi,Fri Nov 15 06:57:27 +0000 2019,0.0,0.0,1.0,0.0
356,BBC News (World),A rubbish story: China's mega-dump full 25 years ahead of schedule https://t.co/LnMd5PauG4,Fri Nov 15 06:55:17 +0000 2019,0.0,0.0,1.0,0.0
357,BBC News (World),"RT @VFritzNews: In it for the ultra long haul. 

Today we want to know - would YOU want to spend more than 19 hours non-stop flying? 

Our…",Fri Nov 15 04:10:11 +0000 2019,0.1531,0.098,0.902,0.0
358,BBC News (World),Australia fires: New blazes forecast as temperatures rise https://t.co/jY0B90xxzJ,Fri Nov 15 04:07:54 +0000 2019,0.0,0.0,1.0,0.0
359,BBC News (World),Quiz of the week: Why did Drake cut short a headline set? https://t.co/jjzmcNbaVL,Fri Nov 15 01:18:27 +0000 2019,-0.2732,0.0,0.84,0.16
360,CBS News,Yovanovitch is applauded on her way out after the conclusion of her hearing https://t.co/qNx16IztcL https://t.co/S2z2QsMQgR,Fri Nov 15 20:28:33 +0000 2019,0.3612,0.152,0.848,0.0
361,CBS News,"Schiff delivers closing remarks for Yovanovitch hearing: ""I think you gathered from our comments that we not only g… https://t.co/an8wKEPwOV",Fri Nov 15 20:21:19 +0000 2019,0.0,0.0,1.0,0.0
362,CBS News,"""Will you be my kidney sista?"": Mom battling Lupus gets organ donation from daughter's teacher… https://t.co/obWjUpxoid",Fri Nov 15 20:19:30 +0000 2019,-0.2732,0.0,0.877,0.123
363,CBS News,"On State Dept.'s handling of Yovanovitch's removal:

Rep. Sean Maloney: ""Did you expect them to have your back?""

Y… https://t.co/wsFax89Afv",Fri Nov 15 20:10:18 +0000 2019,0.0,0.0,1.0,0.0
364,CBS News,"Mark Ronson's ""Uptown Funk"" crowned song of the decade https://t.co/sY5lOptEYX https://t.co/zSJN6V2OGH",Fri Nov 15 19:59:39 +0000 2019,0.0,0.0,1.0,0.0
365,CBS News,"RT @WDYGTN: 2020 presidential candidate Sen. @KamalaHarris is investing heavily in Iowa as the primary season approaches.

@CBSNews' @tperr…",Fri Nov 15 19:59:31 +0000 2019,0.0,0.0,1.0,0.0
366,CBS News,"As Australia's fragile koala bear colonies are being ravaged by bushfires, rescue centers along the country’s east… https://t.co/s3IAwBgp8V",Fri Nov 15 19:40:17 +0000 2019,0.5106,0.163,0.837,0.0
367,CBS News,"Yovanovitch says Ukraine and other countries look to America for ""the power of our example,"" and when the U.S. enga… https://t.co/LHEth5W5ND",Fri Nov 15 19:39:00 +0000 2019,0.0,0.0,1.0,0.0
368,CBS News,"Yovanovitch says she's ""not aware"" of another president asking a foreign country to investigate an American

Rep. J… https://t.co/2TC9pW5hxl",Fri Nov 15 19:29:06 +0000 2019,0.0,0.0,1.0,0.0
369,CBS News,"RT @CBSEveningNews: .@MajorCBS: ""If all of this was so innocent &amp; so benign, why are federal prosecutors already indicting Lev Parnas &amp; Igo…",Fri Nov 15 19:20:58 +0000 2019,0.6917,0.214,0.786,0.0
370,CBS News,"RT @CBSEveningNews: Rep. Eric Swalwell (D-CA): ""Pres. Trump smeared you in Ukraine, smeared you in that phone call with Pres. Zelensky and…",Fri Nov 15 19:20:49 +0000 2019,0.0,0.0,1.0,0.0
371,CBS News,"What have presidents been impeached for? These were the articles of impeachment for Andrew Johnson, Richard Nixon a… https://t.co/9qi9HcMgwd",Fri Nov 15 19:19:30 +0000 2019,0.0,0.0,1.0,0.0
372,CBS News,"Rep. Chris Stewart says he thinks public support for impeachment is ""going to be less when these hearings are over… https://t.co/HcxCBeTvL7",Fri Nov 15 19:06:53 +0000 2019,0.4019,0.119,0.881,0.0
373,CBS News,"Stewart: Do you have any information regarding the president of the United States accepting any bribes? 
Yovanovitc… https://t.co/VEP9vXHezo",Fri Nov 15 19:02:12 +0000 2019,0.6597,0.252,0.748,0.0
374,CBS News,"Joe Biden reacts to the shooting at Saugus High School in California: ""I'm so tired of people talking about your pr… https://t.co/m6eJ2NmGfq",Fri Nov 15 19:00:48 +0000 2019,-0.5777,0.0,0.849,0.151
375,CBS News,"RT @CBSEveningNews: Yovanovitch: ""What we do is inherently non-partisan. It is about our national security interests. It's not about what i…",Fri Nov 15 18:51:55 +0000 2019,0.5267,0.188,0.812,0.0
376,CBS News,"RT @FaceTheNation: AMB. YOVANOVITCH: “In my line of work...all we have is our reputation, and so this has been a very painful period.” http…",Fri Nov 15 18:44:09 +0000 2019,-0.4927,0.0,0.873,0.127
377,CBS News,There have been more mass shootings than days this year https://t.co/e4qyluMQHA https://t.co/ey9t1UHrI4,Fri Nov 15 18:39:30 +0000 2019,0.0,0.0,1.0,0.0
378,CBS News,"Yovanovitch says Trump's attacks have had a ""chilling effect"" on her colleagues in foreign service: ""People don't k… https://t.co/fErrduIn4z",Fri Nov 15 18:36:49 +0000 2019,-0.4588,0.0,0.8,0.2
379,CBS News,"RT @CBSEveningNews: ""I'm not just angry for you I'm angry for every single foreign officer, military officer &amp; every intelligence officer w…",Fri Nov 15 18:30:50 +0000 2019,0.8178,0.309,0.691,0.0
380,The New York Times,"Next week, we'll hear from Lt. Col. Alexander Vindman, Gordon Sondland, Fiona Hill and others relevant to the inqui… https://t.co/UtI1Q6Q5uL",Fri Nov 15 20:57:18 +0000 2019,0.0,0.0,1.0,0.0
381,The New York Times,Will streaming spell the end of cinema or revive it? @aoscott — as Professional Couch Potato and Professional Cinep… https://t.co/w2IExzms1n,Fri Nov 15 20:45:01 +0000 2019,0.34,0.118,0.882,0.0
382,The New York Times,The hearing room broke into applause as Marie Yovanovitch concluded her public testimony in the impeachment inquiry… https://t.co/vBWkSc7dsM,Fri Nov 15 20:38:37 +0000 2019,0.0,0.13,0.741,0.13
383,The New York Times,Breaking News: The Texas parole board unanimously voted to recommend that the governor delay Rodney Reed’s executio… https://t.co/4xs0HAmONa,Fri Nov 15 20:36:27 +0000 2019,0.0516,0.12,0.769,0.111
384,The New York Times,The testimony of Marie Yovanovitch has concluded. Here are key moments from her testimony. https://t.co/d1vTDLbhmX,Fri Nov 15 20:32:15 +0000 2019,0.0,0.0,1.0,0.0
385,The New York Times,The owner of a New York building and 2 others were found guilty in a 2015 gas explosion that killed 2 people and le… https://t.co/V5auISWUnx,Fri Nov 15 20:17:16 +0000 2019,-0.8074,0.0,0.722,0.278
386,The New York Times,We’ve deleted an earlier tweet to this story to correct our description of Senator Warren’s timeline for enacting Medicare for all.,Fri Nov 15 19:49:00 +0000 2019,0.0,0.0,1.0,0.0
387,The New York Times,Elizabeth Warren has vowed to pass major health care legislation in the first 100 days of her presidency. But she w… https://t.co/4QPlZhHQMV,Fri Nov 15 19:45:07 +0000 2019,0.2732,0.091,0.909,0.0
388,The New York Times,"During today’s hearing, Rep. Elise Stefanik brought up the whistleblower. @npfandos, @anniekarni and @julianbarnes… https://t.co/hqzPxvxa3c",Fri Nov 15 19:26:35 +0000 2019,0.0,0.0,1.0,0.0
389,The New York Times,"Marie Yovanovitch on the ""chilling effect"" of President Trump's actions on the Foreign Service: ""People don't know… https://t.co/s2hlQT0DyI",Fri Nov 15 19:08:05 +0000 2019,-0.0258,0.0,0.939,0.061
390,The New York Times,How does Marie Yovanovitch’s testimony add to our understanding of the Trump pressure campaign on Zelensky?… https://t.co/jVPFNxcbcg,Fri Nov 15 19:02:23 +0000 2019,-0.296,0.0,0.879,0.121
391,The New York Times,The FAFSA is the first step to unlocking potential federal financial aid for college. It generates a family’s expec… https://t.co/7N2s2PNM1Z,Fri Nov 15 19:00:14 +0000 2019,0.0,0.0,1.0,0.0
